{
  "schema_version": "corat.context.v1",
  "as_of": "2026-08-27",
  "market_events": [],
  "tickers": {
    "NVDA": {
      "catalysts": [
        {
          "classification": "FACT",
          "credibility": "PRIMARY",
          "source": "NVIDIA Investor Relations",
          "source_url": "https://nvidianews.nvidia.com/news/nvidia-announces-financial-results-for-second-quarter-fiscal-2027",
          "published_at": "2026-08-26",
          "title": "NVIDIA reported fiscal Q2 2027 revenue of $96.2 billion and issued a $108 billion plus-or-minus 2% fiscal Q3 revenue outlook",
          "direction": "BULLISH",
          "freshness": "NEW"
        }
      ],
      "events": [],
      "x_intelligence": [],
      "options_flow": [],
      "mention_acceleration": "DATA UNAVAILABLE"
    },
    "AAPL": {
      "catalysts": [
        {
          "classification": "FACT",
          "credibility": "PRIMARY",
          "source": "Apple Newsroom",
          "source_url": "https://images.apple.com/newsroom/2026/08/apple-introduces-m6-and-m5-ultra-for-a-big-leap-in-performance-and-ai-compute/",
          "published_at": "2026-08-25",
          "title": "Apple announced M6 and M5 Ultra processors and related Mac product updates",
          "direction": "NEUTRAL",
          "freshness": "DEVELOPING"
        }
      ],
      "events": [
        {
          "classification": "FACT",
          "credibility": "PRIMARY",
          "source": "Apple Newsroom",
          "source_url": "https://images.apple.com/newsroom/2026/08/apple-introduces-new-mac-studio-with-m5-max-and-m5-ultra/",
          "published_at": "2026-08-25",
          "event_date": "2026-09-22",
          "title": "Apple stated that the new Mac Studio would begin arriving to customers and stores",
          "direction": "NEUTRAL",
          "freshness": "DEVELOPING"
        }
      ],
      "x_intelligence": [],
      "options_flow": [],
      "mention_acceleration": "DATA UNAVAILABLE"
    },
    "MSFT": {
      "catalysts": [
        {
          "classification": "FACT",
          "credibility": "PRIMARY",
          "source": "Microsoft Investor Relations",
          "source_url": "https://www.microsoft.com/en-us/investor/earnings/fy-2026-q4/press-release-webcast",
          "published_at": "2026-07-29",
          "title": "Microsoft reported fiscal Q4 2026 revenue of $90.0 billion and Azure growth of 43%",
          "direction": "BULLISH",
          "freshness": "STALE"
        }
      ],
      "events": [],
      "x_intelligence": [],
      "options_flow": [],
      "mention_acceleration": "DATA UNAVAILABLE"
    }
  }
}
